prefix,input_text,target_text
English to Thai,The electric furnace temperature control system is one of the real-world second-order systems plus time delay (SOSPD) widely used as the process control in industries.,ระบบควบคุมอุณหภูมิเตาหลอมไฟฟ้าเป็นระบบอันดับสองที่มีการประวิงเวลา (Second-Order System Plus Time Delay: SOSPD) ที่ใช้กันอย่างแพร่หลายในการควบคุมกระบวนการในอุตสาหกรรม
English to Thai,It is normally operated under the PID feedback control loop.,โดยปกติจะดำเนินการภายใต้ลูปควบคุมป้อนกลับแบบ PID
English to Thai,"The PIDA controller, however, performed better response than the PID controller for higher order plant.",แต่อย่างไรก็ตาม ตัวควบคุม PIDA ยังให้ผลตอบสนองที่ดีกว่าตัวควบคุม PID สำหรับโรงงานที่มีลำดับสูงกว่า
English to Thai,"In this paper, an optimal PIDA controller design for the electric furnace temperature control system is presented. ""Regarding to modern optimization context, the Bat-inspired Algorithm (BA) which is one of the most efficient population-based metaheuristic optimization techniques is applied to search for the appropriate PIDA’s parameters.""",ในวิจัยนี้จะนำเสนอการออกแบบตัวควบคุม PIDA ที่เหมาะสมที่สุดสำหรับระบบควบคุมอุณหภูมิของเตาไฟฟ้า เกี่ยวกับบริบทการเพิ่มประสิทธิภาพที่ทันสมัย ด้วยอัลกอลิทึมที่ได้รับแรงบันดาลใจจากค้างคาว (BA) ซึ่งเป็นหนึ่งในเทคนิคการเพิ่มประสิทธิภาพเมตาฮิวริสติก ตามประชากรที่มีประสิทธิภาพมากที่สุดถูกนำไปใช้เพื่อค้นหาพารามิเตอร์ของ PIDA ที่เหมาะสม
English to Thai,The proposed BA-based PIDA design framework is considered as the constrained optimization problem.,เฟรมเวิร์กในการออกแบบ PIDA ที่ออกแบบโดย BA ที่เสนอถือเป็นปัญหาการปรับให้เหมาะสมที่มีข้อจำกัด
English to Thai,System responses obtained by the PIDA controller designed by the BA will be compared with those obtained by the PIDA controller also designed by the BA.,การตอบสนองของระบบที่ได้รับจากคอนโทรลเลอร์ PIDA ที่ออกแบบโดย BA จะถูกนำไปเปรียบเทียบกับการตอบสนองที่ได้รับจากคอนโทรลเลอร์ PIDA ด้วย
English to Thai,"As results, it was found that the PIDA can provides the very satisfactory tracking and regulating responses of the electric furnace temperature control system superior to the PIDA, significantly.",จากผลการวิจัยพบว่า PIDA ที่ออกแบบด้วย BA สามารถติดตามและควบคุมการตอบสนองของระบบควบคุมอุณหภูมิเตาไฟฟ้าที่เหนือกว่า PIDA ได้อย่างน่าพอใจอย่างมาก
English to Thai,This research presents the application of a Programmable logic controller to control the operation of an automatic drinking water filling machine.,งานวิจัยฉบับนี้นำเสนอการวิเคราะห์ประสิทธิภาพของเครื่องบรรจุน้ำดื่มอัตโนมัติต้นทุนต่ำแบบหัวจ่ายเดียวที่ควบคุมการทำงานด้วยโปรแกรมเมเบิลลอจิกคอนโทรลเลอร์
English to Thai,The PLC is used to control the operation of the DC motor and control the stepper motor of the automatic drinking water filling machine.,ซึ่งโปรแกรมเมเบิลลอจิกคอนโทรลเลอร์ถูกใช้ควบคุมการทำงานมอเตอร์ไฟฟ้ากระแสตรงและควบคุมสเต็ปมอเตอร์ของตัวเครื่องบรรจุน้ำดื่มอัตโนมัติ
English to Thai,"The working principle is as follows: 1) When a water bottle is placed on the conveyor belt, a conveyor belt delivers the bottles to the water-filling point.",โดยมีหลักการทำงานเป็นขั้นตอนดังนี้ 1) เมื่อนำขวดน้ำวางที่สายพานลำเลียง สายพานลำเลียงจะส่งขวดไปยังจุดบรรจุน้ำ
English to Thai,"2) When the water is filled to the right volume, the water bottle will be moved from the water-filling point to the capping point using the stepper motor rotation.",2) เมื่อบรรจุน้ำจนถึงปริมาตรที่เหมาะสมจะย้ายขวดน้ำจากจุดบรรจุน้ำไปยังจุดปิดขันฝาโดยใช้การหมุนจากสเต็ปมอเตอร์
English to Thai,"3) The process of capping the bottle cap tightening by direct current electric motor and air cylinder with a sensor to order the air cylinder to push down to close the lid, and the DC electric motor rotates to close the lid to the screw, and 4) When the lid is closed, the stepping motor rotates to bring the closed water bottle to the leg conveyor.",3) ขั้นตอนการปิดฝาขวดน้ำดื่ม ทำการขันฝาขวดด้วยมอเตอร์ไฟฟ้ากระแสตรงและกระบอกลม โดยมีเซนเซอร์สั่งการให้กระบอกลมดันลงมาปิดฝาและมอเตอร์ไฟฟ้ากระแสตรงหมุนเพื่อทำการปิดฝาให้เข้าเกลียว และ 4) เมื่อปิดฝาเสร็จสเต็ปมอเตอร์หมุนเพื่อนำตัวขวดน้ำที่ปิดแล้วไปที่สายพานลำเลียงขาออก ทำการทดสอบประสิทธิภาพการทำงานของเครื่องบรรจุน้ำดื่มอัตโนมัติ มาตรฐานการวิเคราะห์ทางสถิติ (analytical statistics) ถูกนำมาประยุกต์ใช้สำหรับการวิเคราะห์ผลการทดสอบของเครื่องบรรจุน้ำดื่มอัตโนมัติ
English to Thai,"The operation of the automatic drinking water filling machine was tested using statistical analysis standards with a total of 30 tests consisting of 3 values: finding the average value of the bottled drinking water volume at 597.27 milliliters and the standard deviation is 2.87 and the root mean square error (RMSE) is 1.95, meaning the water filling machine has an error of ± 1.95. The test results to find the optimum production cycle time of 12 minutes and the water filling rate found that it could fill an average of 8 bottles of water per minute.",โดยทำการทดสอบทั้งหมด 30 ครั้ง ประกอบด้วย 3 ค่า คือ การหาค่าเฉลี่ยของปริมาณน้ำดื่มที่บรรจุได้อยู่ที่ 597.27 มิลลิลิตร ค่าเบี่ยงเบนมาตรฐาน (SD) อยู่ที่ 2.87 และคารากที่สองของค่าความคลาดเคลื่อนกำลังสอง (RMSE) มีค่า 1.95 แปลผลว่าเครื่องบรรจุน้ำคลาดเคลื่อนอยู่ที่ ± 1.95 มีผลการทดสอบหารอบเวลาการผลิตที่เหมาะสมอยู่ที่ 12 นาที และอัตราการบรรจุน้ำพบว่าสามารถบรรจุน้ำได้เฉลี่ย 8 ขวดต่อนาที
English to Thai,The energy consumption was found to use a maximum power of 32.1 W with an energy of 0.6 Wh per bottle.,ผลด้านการใช้พลังงานไฟฟ้าพบว่าใช้กำลังไฟฟ้าสูงสุด 32.1 วัตต์ โดยใช้พลังงานต่อการทำงาน 1 ขวดเท่ากับ 0.6 วัตต์ชั่วโมง
English to Thai,"The automatic drinking water filling machine that has been created has an Availability% is at 99%, a Performance% is at 100%, a quality rate is at 88.89% and an overall equipment effectiveness is at 88.00%.",เครื่องบรรจุน้ำดื่มอัตโนมัติที่ได้สร้างขึ้นมีอัตราการเดินเครื่องร้อยละ 99 ค่าประสิทธิภาพการเดินเครื่องร้อยละ 100 อัตราคุณภาพร้อยละ 88.89 และค่าประสิทธิผลโดยรวมของเครื่องจักร (Overall Equipment Effectiveness) อยู่ที่ร้อยละ 88.00
English to Thai,"Compared to industrial machines, automatic drinking water filling machines are generally considered to have good overall performance at a lower cost than the market price.",เมื่อเทียบกับเครื่องจักรในอุตสาหกรรมโดยทั่วไปถือว่าเครื่องบรรจุน้ำดื่มอัตโนมัติมีประสิทธิผลโดยรวมในระดับดี และในส่วนของต้นทุนในการสร้างเครื่องพบว่ามีราคาต่ำกว่าราคาขายบนท้องตลาด
English to Thai,The research discusses the single order inventory replenishment policy for a system consisting of three inventory items with substitutability.,งานวิจัยศึกษาการกำหนดนโยบายเติมเต็มวัสดุคงคลังครั้งเดียวสำหรับระบบที่มีวัสดุคงคลังสามประเภทสามารถใช้งานทดแทนกันได้
English to Thai,The leftovers of lower-cost inventory items can be either used to satisfy those demands occurred from the shortage of higher-cost inventory items with a specified ratio or sold at their salvage value.,วัสดุคงคลังคงเหลือที่มีต้นทุนต่ำกว่าสามารถนำมาใช้ตอบสนองอุปสงค์ที่ขาดแคลนของวัสดุคงคลังที่มีต้นทุนสูงกว่าด้วยอัตราส่วนทดแทนที่กำหนด หรือขายในราคามูลค่าซาก
English to Thai,"In order to determine the proper order quantity for each inventory item, the method based on the concept of mathematical solving on a Monte Carlo simulation model is proposed.",งานวิจัยได้นำเสนอวิธีการค้นหาคำตอบตัวแบบทางคณิตศาสตร์บนตัวแบบจำลองสถานการณ์มอนติคาร์โล ซึ่งถูกสร้างขึ้นบนแพลตฟอร์มของโปรแกรมไมโครซอฟท์เอ็กเซล และฟังก์ชันโซลเวอร์ถูกนำมาประยุกต์ใช้เพื่อกำหนดปริมาณการเติมเต็มวัสดุคงคลังแต่ละประเภทที่เหมาะสม
English to Thai,"This can be done by modeling the system on the Microsoft Excel platform and, with the objective function of maximizing the expected system profit, applying the solver function to determine a good solution.",โดยมีสมการวัตถุประสงค์คือการเพิ่มค่าคาดหวังผลกำไรรวมของระบบ
English to Thai,"For the performance evaluation, 120 experimental problems are randomly generated considering two main factors, salvage value (2 levels) and substitution ratio (2 levels), with 30 replications for each treatment combination.",เพื่อวัดประสิทธิภาพของวิธีการที่นำเสนอ ปัญหาทดสอบจำนวน 120 ปัญหา ถูกสุ่มขึ้นจากการพิจารณาปัจจัยมูลค่าซากสองระดับ และปัจจัยอัตราส่วนทดแทนสองระดับ โดยมีจำนวนการทำซ้ำ 30 ปัญหา ที่แต่ละระดับของปัจจัย
English to Thai,"The solution obtained from the proposed method is compared with the solution yielded from the traditional benefit analysis method, which is to independently determine the single order quantity of each inventory item without the consideration of substitution opportunity.",คำตอบที่ได้จากวิธีการที่นำเสนอถูกนำไปเปรียบเทียบกับ คำตอบที่ได้จากวิธีการวิเคราะห์ผลได้ประโยชน์ซึ่งพิจารณาปริมาณสั่งเติมเต็มวัสดุคงคลังแต่ละประเภทเป็นอิสระต่อกัน
English to Thai,"According to the study result, in comparison to the benefit analysis method, the proposed method provides a larger expected profit for all 120 experimental problems.",จากผลการทดสอบพบว่า วิธีการที่นำเสนอให้คำตอบที่มีค่าคาดหวังผลกำไรรวมของระบบสูงกว่าวิธีการวิเคราะห์ผลได้ประโยชน์ทั้ง 120 ปัญหาทดสอบ
English to Thai,"Moreover, the main influences of salvage value and substitution affect the percentage difference in profit between the proposed method and the benefit analysis approach.",ทั้งนี้อิทธิพลหลักของปัจจัยมูลค่าซากและปัจจัยอัตราส่วนทดแทน มีผลต่อเปอร์เซ็นต์ความแตกต่างของผลกำไรระหว่างวิธีการที่นำเสนอและวิธีการวิเคราะห์ผลได้ประโยชน์
English to Thai,"Here, the percentage difference in profit increases at the lower levels of both factors.",โดยเปอร์เซ็นต์ความแตกต่างของผลกำไรมีค่าสูงขึ้นที่ระดับต่ำของปัจจัยทั้งสอง
English to Thai,"At present, perpetual futures contracts on cryptocurrency trading still face the risk of ruin.",ในปัจจุบันการซื้อขายสัญญาแลกเปลี่ยนคริปโทเคอร์เรนซีของนักลงทุนยังคงประสบปัญหาเกิดความเสี่ยงในการล้มละลายจากการลงทุน
English to Thai,"Therefore, this research was conducted with the objectives of creating an algorithm of multiple indicators to predict the trading positions, developing the computer program for generating trading strategies, creating the automatic system for cryptocurrency perpetual futures contract trading, and measuring the financial performance of the automatic trading system.",การวิจัยครั้งนี้จึงมีวัตถุประสงค์เพื่อสร้างอัลกอริทึมสำหรับการทำนายจุดซื้อขายเชิงมิติชี้วัดที่หลากหลาย พัฒนาโปรแกรมคอมพิวเตอร์สำหรับสร้างกลยุทธ์การซื้อขาย สร้างระบบอัตโนมัติเพื่อการซื้อขายสัญญาแลกเปลี่ยนคริปโทเคอร์เรนซี และวัดประสิทธิภาพด้านการเงินของระบบอัตโนมัติเพื่อการซื้อขาย
English to Thai,"The financial performance measurement was divided into two parts: a backward test, which involved evaluating historical data over a 3-month period, and a forward test, which involved testing system using current real trading data during a 3-month period.",การวัดประสิทธิภาพด้านการเงินแบ่งเป็น 2 ส่วน คือ การทดสอบแบบย้อนหลัง (backward test) ซึ่งเป็นการทดสอบข้อมูลย้อนหลัง โดยกำหนดระยะเวลาในการทดสอบประสิทธิภาพเป็นระยะเวลา 3 เดือน และการทดสอบแบบไปข้างหน้า (forward test) ซึ่งเป็นการทดสอบโดยการใช้ข้อมูลการซื้อขายจริงเป็นปัจจุบันขณะที่ทดสอบ
English to Thai,The total testing duration was 6 months.,โดยกำหนดระยะเวลาในการทดสอบประสิทธิภาพเป็นระยะเวลา 3 เดือน รวมระยะเวลาทดสอบทั้งหมด 6 เดือน
English to Thai,"The results revealed that both the backward and the forward tests achieved a 3-month profitability efficiency of 130% and 140%, respectively.",ผลการศึกษาพบว่า การจำลองการทดสอบทั้งการทดสอบแบบย้อนหลังและการทดสอบแบบไปข้างหน้าสามารถทำกำไรต่อ 3 เดือน ได้ในระดับสูงถึงร้อยละ 130 และ 140 ตามลำดับ
English to Thai,"The overall accuracy rates were 72.00% and 80.39%, respectively.",และมีค่าความแม่นยำโดยรวมเท่ากับร้อยละ 72.00 และ 80.39 ตามลำดับ
English to Thai,It has been shown that investing with the automatic system for perpetual futures contracts on cryptocurrency trading using the algorithm of multiple indicators to predict the trading positions has the potential to generate greater returns than the general traders.,แสดงให้เห็นว่าการลงทุนด้วยระบบอัตโนมัติเพื่อการซื้อขายสัญญาแลกเปลี่ยนคริปโทเคอร์เรนซีโดยใช้อัลกอริทึมการทำนายจุดซื้อขายเชิงมิติชี้วัดที่หลากหลายสามารถสร้างผลตอบแทนได้มากกว่านักลงในทุนตลาด
English to Thai,"This research aimed to develop a 200-liter iron kiln to produce biochar and wood vinegar from pineapple leaves provided from Khao Khan Song sub-district, Sriracha district, Chon Buri province.",งานวิจัยนี้มีวัตถุประสงค์เพื่อพัฒนาเตาเผาจากถังเหล็กขนาด 200 ลิตร สำหรับผลิตถ่านชีวภาพและน้ำส้มควันไม้จากใบสับปะรด ในพื้นที่ตำบลเขาคันทรง อำเภอศรีราชา จังหวัดชลบุรี
English to Thai,The preliminary experiments were conducted in the laboratory scale to determine the optimum operating temperature and time for biochar production.,โดยทำการทดลองเบื้องต้นในห้องปฏิบัติการเพื่อหาอุณหภูมิและเวลาที่เหมาะสมต่อการผลิตถ่านชีวภาพ
English to Thai,"The experimental results showed that the highest solid yield was 33.02 wt.%, obtained at 400 °C and for 1 h, with the highest heating value as 23.25 MJ/kg.",จากการทดลองพบว่าผลได้ของแข็งสูงที่สุด คือ ร้อยละ 33.02 ที่อุณหภูมิ 400 องศาเซลเซียส เวลา 1 ชั่วโมง และมีค่าความร้อนสูงสุดเท่ากับ 23.25 เมกะจูลต่อกิโลกรัม
English to Thai,"The 200-liter iron kiln was then developed consisting of 3 parts: biochar production kiln, condensation apparatus for storing wood vinegar and combustion kiln for heat production.",จากนั้นทำการพัฒนาเตาเผาที่ประกอบด้วย เตาเผาเพื่อผลิตถ่านชีวภาพ ชุดท่อควบแน่นเพื่อเก็บน้ำส้มควันไม้ และเตาเผาไหม้เพื่อให้ความร้อนแก่เตาเผาส่วนแรก
English to Thai,It was found that the developed 200-liter iron kiln could produce biochar and wood vinegar from pineapple leaves.,จากการทดลองพบว่าเตาเผาที่พัฒนาขึ้นสามารถผลิตถ่านชีวภาพจากใบสับปะรดและน้ำส้มควันไม้ได้
English to Thai,The 20 kg of pineapple leaves can produce approximately 2 kg of biochar and 10 kg of wood vinegar.,โดยใบสับปะรด 20 กิโลกรัม สามารถผลิตถ่านชีวภาพได้ประมาณ 2 กิโลกรัม และน้ำส้มควันไม้ประมาณ 10 กิโลกรัม
English to Thai,The analysis of biochar revealed that biochar had 70.49 wt.% of Carbon content with the highest heating value of 25.97 MJ/kg.,จากการวิเคราะห์สมบัติของถ่านชีวภาพพบว่าคาร์บอนเป็นองค์ประกอบร้อยละ 70.49 มีค่าความร้อนสูงสุด 25.97 เมกะจูลต่อกิโลกรัม
English to Thai,"The generated wood vinegar is mainly composed of Phenols and Phenol derivatives, including Guaiacol which has antifungal and antibacterial properties.",ในขณะที่น้ำส้มควันไม้มีองค์ประกอบส่วนใหญ่เป็นฟีนอล (Phenol) และอนุพันธ์ของฟีนอล (Phenol Derivatives) ซึ่งรวมถึงไกวเอคอล (Guaiacol) ที่มีฤทธิ์เป็นสารต้านเชื้อราและสารต้านเชื้อแบคทีเรีย
