prefix,input_text,target_text
Thai to English,เริ่มจากกระบวนการ  Traca  จนถึง  กระบวนการ  Climatic  Test แนวทางที่เหมาะสมคือ  แผนการปรับปรุงที่  2,The simulation was done by starting from Traca (RI) process to Climatic Test process.
Thai to English,(การเพิ่มความจุการทดสอบซอฟต์แวร์ในกระบวนการ Sub  System  Test  1 ตำแหน่ง และการขนย้ายชิ้นงานจากกระบวนการ  Warm  Up  ไปกระบวนการ  Sub  System  Test  ขนย้ายรอบละ  4  ชิ้น),The suitable improvement was the proposed plan 2 (increase one capacity in software testing of Sub System Test process and increase a number of workpieces to be four units in transferring from Warm Up process to Sub System Test process).
Thai to English,หลังการปรับปรุงพบว่าค่าอรรถประโยชน์โดยรวมเพิ่มขึ้น  5%  เวลารอคอยลดลง  85.19%  และจำนวนชิ้นงานที่ออกจากระบบเพิ่มขึ้น 37.50%,"Findings from simulation models, the efficiency of ultra-broadband transceivers manufacturing process was increased with higher utilization for 5%, lower waiting time for 85.19% and higher productivity for 37.50%."
Thai to English,การศึกษานี้มีวัตถุประสงค์เพื่อศึกษาความพร้อมด้านเทคโนโลยีของลูกค้าธุรกิจ SMEs ส่งผลต่อการตัดสินใจซื้อผลิตภัณฑ์ผ่านช่องทางออนไลน์,This research aims to study SMEs customers’ technology readiness in the decision of purchasing products via online channels by applying the Technology Readiness Index.
Thai to English,โดยประยุกต์ใช้ดัชนีความพร้อมด้านเทคโนโลยี (Technology Readiness Index: TRI) ข้อมูลเชิงประจักษ์ที่ได้จากการเก็บแบบสอบถามด้วยวิธีการสุ่มตัวอย่างแบบง่าย จำนวน 410 คน จากลูกค้าที่เคยซื้อผลิตภัณฑ์ในเขตพื้นที่จังหวัดมหาสารคาม และในพื้นที่ใกล้เคียง,The empirical data were obtained by using Simple sampling method for collecting 410 people previously purchasing products in the area of Maha Sarakham Province and its surrounding area.
Thai to English,จะนำมาวิเคราะห์องค์ประกอบเชิงยืนยัน (Confirmatory factor analysis) เพื่อจัดกลุ่มและหาความสอดคล้องของข้อมูล โดยพิจารณานัยสำคัญทางสถิติระดับ 0.1,The Confirmatory factor analysis was conducted to group variables and find their consistency by considering statistical significance at 0.05 level.
Thai to English,"ผลการศึกษาพบว่า โมเดลองค์ประกอบเชิงยืนยันมีความเหมาะสม ที่ค่าพารามิเตอร์ CMIN-ρ=0.471, CMIN/df=1.004, GFI=0.961, และ RMSEA=0.003","The confirmatory factor analysis model was consistent at the following parameter values: CMIN-ρ = 0.471, CMIN / df = 1.004, GFI = 0.961, and RMSEA = 0.003."
Thai to English,ส่วนผลของการวิเคราะห์การถดถอยพหุคูณ (Multiple Regression Analysis) พบว่า ตัวแปรการมองโลกในแง่ดีที่เกี่ยวกับเทคโนโลยี (Optimism) และ ความมีนวัตกรรม (Innovativeness) ส่งผลเชิงบวก ส่วนตัวแปรความรู้สึกไม่ปลอดภัยในการใช้เทคโนโลยี (Insecurity) ส่งผลเชิงลบต่อการตัดสินใจซื้อผลิตภัณฑ์ผ่านช่องทางออนไลน์อย่างมีนัยสำคัญทางสถิติ โดยมีค่า r2 เท่ากับ 0.314,The results of multiple regression analysis of which r2 = 0.314 found that Optimism and Innovativeness variables had a positive effect; and Insecurity variable had a negative statistically significant impact on online purchasing decisions.
Thai to English,ดังนั้นงานวิจัยนี้จึงสรุปได้ว่า ลูกค้าในธุรกิจ SMEs นี้มีความพร้อมในการสั่งซื้อผลิตภัณฑ์ผ่านช่องทางออนไลน์ เนื่องจากมีมุมมองที่เป็นบวกเกี่ยวกับด้านเทคโนโลยี,"Therefore, this research can conclude that customers in this SMEs business are ready to order products through online channels because they see technology as positives."
Thai to English,แต่อย่างไรก็ตามถ้าลูกค้ามีความกังวลใจเกี่ยวกับความปลอดภัยในการทำธุรกรรมการเงินก็จะทำให้การปรับเปลี่ยนวิธีการสั่งซื้อมาเป็นผ่านช่องทางออนไลน์ได้ยากขึ้น,"However, if the customers are concerned about the security of their financial transactions, it will be more difficult to change the method of ordering products to online channels."
Thai to English,บทความนี้ มีวัตถุประสงค์เพื่อศึกษาปัจจัยพยากรณ์ที่ส่งผลต่อการตัดสินใจเลือกใช้บริการท่าเรือสินค้าทั่วไป,This article aims to study the predictive factors affecting the decision to choose a general cargo port service.
Thai to English,ในการศึกษานี้ กลุ่มตัวอย่าง 290 ตัวอย่างมาจากผู้ประกอบการนำเข้า–ส่งออกสินค้าทั่วไปหรือผู้ใช้บริการท่าเรือกรณีศึกษา,"In the study, 290 samples come from the importers-exporters of general merchandisers and port-services users of a case study."
Thai to English,แบบสอบถามปัจจัยที่ส่งผลต่อการตัดสินใจได้ถูกนำมาใช้เป็นเครื่องมือในการศึกษา ซึ่งประกอบด้วย 7 ด้าน ได้แก่ 1) ด้านการบริการ 2) ด้านราคา,The tool as a questionnaire on factors affecting the decision is also used.
Thai to English,3) ด้านสถานที่ 4) ด้านการส่งเสริมการตลาด 5) ด้านบุคคล 6) ด้านกระบวนการ และ 7) ด้านลักษณะทางกายภาพ,"It was included by 7 aspects as follows: 1) service, 2) price, 3) location, 4) marketing promotion, 5) personnel, 6) process, and 7) physical appearance."
Thai to English,จากนั้นข้อมูลที่เก็บรวบรวมได้ถูกนำมาประมวลผลและวิเคราะห์ด้วยโปรแกรมซอฟแวร์ทางสถิติ,"Then, the collected data are processed and analyzed by a statistical software program."
Thai to English,โดยสถิติที่ใช้ในการวิเคราะห์ข้อมูล คือ สถิติเชิงพรรณนาและการถดถอยเชิงพหุคูณแบบขั้นตอน,The statistics used in data analysis are descriptive statistics and stepwise multiple regression.
Thai to English,ผลการวิจัย พบว่า ปัจจัยที่มีค่าเฉลี่ยสูงสุดที่ 4.75 คือ ด้านบุคลากร,The results showed that the factor with the highest average as 4.75 personnel aspect.
Thai to English,ปัจจัยที่มีค่าเฉลี่ยรองลงมา คือ บริการ ลักษณะทางกายภาพ ราคา กระบวนการ การส่งเสริมการตลาด และสถานที่ คือ 4.67 4.66 4.62 4.62 4.44 และ 4.40 ตามลำดับ,"At the factor with followed average, service, physical appearance, price, process, marketing-promotion, and location are 4.67, 4.66, 4.62, 4.62, 4.44, and 4.40 respectively."
Thai to English,นอกจากนี้ สมการพยากรณ์ที่มีอิทธิพลต่อการตัดสินใจเลือกใช้บริการท่าเรือสินค้าทั่วไป ได้แก่ ด้านลักษณะทางกายภาพ ด้านบุคคล ด้านการบริการ และด้านกระบวนการ,"In addition, the predictive equations influencing the decision to use a general cargo port are physical, personnel, service, and process."
Thai to English,โดยสรุปผลการวิจัยนี้ สามารถนำไปใช้เป็นแนวทางในการพัฒนาและปรับปรุงการให้บริการของท่าเรือสินค้าทั่วไปต่อไป,"In summary, this research results could be used as a guideline for further development and improvement of services of the general cargo ports."
Thai to English,บทความนี้มีวัตถุประสงค์เพื่อศึกษาประสิทธิภาพการกำจัดความขุ่นของถังตกตะกอนชนิดหมุนเวียนตะกอนเมื่อปรับเปลี่ยนความเร็วรอบของใบกวน,This paper aims to study the turbidity removal efficiency of sludge recirculation clarifier when changing impeller rotating speed.
Thai to English,"โดยการควบคุมอัตราการเติมสารส้ม จาก 13, 17 และ 21 มิลลิกรัม/ลิตร และอัตราการผลิตจาก 2.2, 2.4 และ 2.6 ลูกบาศก์เมตร/วินาทีถูกใช้ในการทดสอบ","The alum dosing rates of 13, 17 and 21 mg/l and production rates of 2.2, 2.4 and 2.6 cubic meter per second (cms) were applied in the study."
Thai to English,ผลของความเร็จวรอบของใบกวนที่เหมาะสมสอดคล้องกับค่าประสิทธิภาพการกำจัดความขุ่นดีที่สุด,The effect of optimized impeller rotating speeds corresponded to the best turbidity removal efficiency.
Thai to English,ผลการทดลองพบว่า ความสัมพันธ์ระหว่างความเร็วรอบของใบกวนและประสิทธิการกำจัดความขุ่นมีแนวโน้มแบบสมการโพลิโนเมียลยกกำลัง 3,Experimental results found that the relationship between the impeller rotating speeds and turbidity removal efficiency tended to in the third order polynomial equation.
Thai to English,โดยในช่วงความเร็วรอบใบกวน 1.3-1.6 รอบ/นาที จะให้ประสิทธิภาพการกำจัดความขุ่นค่อนข้างต่ำ,"In the range of 1.3-1.6 rpm of impeller rotating speeds, the turbidity removal efficiencies were relatively low."
Thai to English,ส่วนในช่วงความเร็วรอบใบกวน 1.6-2.0 รอบ/นาที จะให้ประสิทธิภาพการกำจัดความขุ่นเพิ่มสูงขึ้นตามความเร็วรอบใบกวน เนื่องจากความเร็วรอบของใบกวนจะทำให้เกิดการไหลเวียนของตะกอนภายในส่วนกวนช้า,"In the range of 1.6-2.0 of impeller rotating speeds, the turbidity removal efficiencies were increased with impeller rotating speeds."
Thai to English,เมื่อความเร็วของใบกวนเพิ่มสูงขึ้นจะทำให้ตะกอนเกิดการชนกันและรวมตัวกันเป็นตะกอนขนาดใหญ่ขึ้น การเพิ่มความเร็วรอบของใบกวนจาก 2.0 ถึง 2.2 รอบ/นาที ส่งผลให้ประสิทธิภาพการกำจัดความขุ่นลดต่ำลง,The increased impeller rotating speeds from 2.0 to 2.2 rpm resulted in relatively low of turbidity removal efficiencies.
Thai to English,เนื่องจากการเพิ่มความเร็วรอบของใบกวนส่งผลให้เกิดการชนกันมากเกินไป ตะกอนขนาดใหญ่จึงแตกตัวเป็นตะกอนที่มีขนาดเล็กลง,"The increased impeller rotating speeds could possibly induce the sludge collision, thus decreasing sludge size."
Thai to English,"นอกจากนี้ ""ผลของอัตราการเติมสารส้มและอัตราการผลิตส่งผลต่อประสิทธิภาพการกำจัดความขุ่นด้วย ค่าที่เหมาะสมจากอัตราการเติมสารส้ม 17 มิลลิกรัม/ลิตร, อัตราการผลิต 2.4 ลูกบาศก์เมตร/วินาทีและความเร็วรอบของใบกวน 1.9-2.1 รอบ/นาที  ให้ค่าประสิทธิภาพการกำจัดความขุ่นสูงเท่ากับร้อยละ 89.4±1.18""","In addition, the alum dosing rates and production rates were also affected with turbidity removal efficiencies. ""The optimum conditions caused by 17 mg/l of alum dosing rate, 2.4 cms of production rate and 1.9-2.1 rpm of Impeller rotating speeds provided high turbidity removal efficiencies of 89.4±1.18%."""
Thai to English,"งานวิจัยนี้เสนอแนวทางใน การหยั่งความพร้อมและกระตือรือร้นในการใช้งานเทคโนโลยีสารสนเทศและการสื่อสาร (Information and Communication Technology, ICT) โดยสำรวจ ระดับการใช้งาน การรับรู้และตื่นตัวต่อประโยชน์ของ ICT ""โดยใช้ตัวอย่างสถานประกอบการขนาดกลางและขนาดย่อม (Small and Medium Enterprises, SMEs)""","This research presents a guideline to probing  consciousness and eagerness of small and medium enterprises (SMEs) in raising their level of use and inclination of information and communication Technology, ICT) by surveying awareness and attentiveness of ICT among selected Small and medium enterprises (SMEs)."
Thai to English,ความสามารถในการแข่งขันของผู้ประกอบการในส่วนที่มาจากผลิตภาพและประสิทธิภาพมีความสำคัญต่อความเติบโตและเจริญรุ่งเรืองของกิจการ,Proficiency arising form organization productivity and efficiency has played an important role for the prosperity.
Thai to English,"งานวิจัยนี้นำเสนอแนวความคิด ""Bootstrapping"" หรือการปลุกระบบเพื่อให้การประเมินตนเองถึงระดับการใช้งานและแนวโน้มความต้องการในการใช้ ICT","This research employs the concept of ""Bootstrapping"" as a tool to evaluate the current ICT usage level as well as to include more relevance into perspective."
Thai to English,"การทำ Bootstrapping เกิดขึ้นจากการเปรียบเทียบหัวข้อต่างๆใน ""Quality"" หรือความต้องการการใช้งานของผู้ปฏิบัติการ กับ ""Function"" หรือกลไกในบริบทของการวางแผนและควบคุมการผลิต (Production Planning and Control, PPC) ซึ่งความต้องการเหล่านี้ ถือเป็นจุดเริ่มต้น และทิศทาง ของประเด็นต่างๆที่เกี่ยวข้องกับการใช้ ICT ในการประกอบการ","The process concerns survey planning, gathering the data, performing statistical analysis and interpretation which is carried out by means of mapping quality or what is perceptually required to actually achieve the operational goals to the traditional production planning and control principles."
Thai to English,ผลการวิเคราะห์เผยให้เห็นว่าสำหรับ ในบรรดา 26 หัวข้อ มี 5 หัวข้อ ที่ผู้ปฏิบัติงานได้มีการนำใช้ ICT ถึงระดับที่ตนพอใจแล้ว,The analysis reveals that five out of the 26 scrutinized ICT aspects are statistically identified by the respondents to have been adopted on regular basis.
Thai to English,การที่ผู้ตอบมีความปารถนาจะยกระดับการใช้งาน ICT ย่อมหมายถึงภาวการณ์รับรู้ที่พร้อมที่จะถูกกระตุ้นและมีความกระตือรือร้นในหัวข้อเหล่านั้น,"The disagreement between existing and desirable level of implementation levels of the rest implies that the importance of the ICT is, in general, perceptive."
Thai to English,ผลการศึกษาล่าสุดเมื่อราวกลางปี 2563 ที่ให้ผลคล้ายคลึงกันยืนยันผลความเป็นทั่วไปของภาวการณ์,A later study showing the practically the same result confirms the same pattern of awareness in ICT.
Thai to English,เพื่อนำไปสู่ข้อสรุปอื่นๆ เพิ่มเติม เช่นหัวข้อที่มีการเห็นพ้องกันจากมากไปหาน้อย,"Additional statistical techniques may be used to draw conclusions on certain aspects, for instance, aspects by number of respondents that agreed upon."
Thai to English,บทความวิจัยนี้มีวัตถุประสงค์เพื่อศึกษาหาค่าประสิทธิภาพการทำความเย็นและสมรรถนะการทำความเย็นของท่อวอร์เทกซ์ อันเนื่องมาจากการเปลี่ยนระยะโค้งเว้าบนหน้าตัดของวาล์วทรงกรวยในท่อวอร์เทกซ์,This study aimed to investigate the cooling efficiency and coefficient of performance of a vortex tube with change in the arc distance of a vortex tube cone valve.
Thai to English,"ในการทดลองได้ดำเนินการโดยใช้ระยะโค้งเว้าบนวาล์วทรงกรวยที่ขนาด 0, 1, 2, 3 และ 4 มิลลิเมตร","A study was performed using the arc distance of vortex tube cone valves at sizes of 0, 1, 2, 3 and 4 mm."
Thai to English,"และปรับความดันที่ทางเข้าท่อวอร์เทกซ์ 1, 1.5, 2, 2.5, 3, 3.5 และ 4 Bar","The pressure was adjusted at the inlet vortex of 1, 1.5, 2, 2.5, 3, 3.5 and 4 Bar."
Thai to English,โดยในการทดลองนี้ใช้อากาศที่ไม่ได้ควบคุมอุณหภูมิทางเข้า ที่อุณหภูมิแวดล้อมประมาณ 33 °C,"The experiment used uncontrolled temperature air, air at an ambient temperature of about 33 °C."
Thai to English,จากการทดลองพบว่า เมื่อระยะโค้งเว้าบนวาล์วทรงกรวยเพิ่มขึ้นส่งผลต่ออุณหภูมิทางออกทั้งสองด้าน และเมื่อความดันเพิ่มขึ้นอุณหภูมิที่ทางออกด้านอุณหภูมิต่ำจะลดลงซึ่งแปรผันกับประสิทธิภาพการทำความเย็นและสมรรถนะการทำความเย็นจะเพิ่มขึ้นเช่นกัน โดยที่ระยะโค้งเว้าบนวาล์วทรงกรวยขนาด 3 มิลลิเมตร มีประสิทธิภาพการทำความเย็นและมีสัมประสิทธิ์สมรรถนะการทำความเย็นดีที่สุดสำหรับการทดลองนี้,"From the experiment, results showed that an increase in the arc distance on a vortex tube cone valve affects the outlet temperature on both sides. ""The increased pressure led to a drop in temperature at the cold exit, which was in proportion to the increase in the cooling efficiency and coefficient of performance."" ""At 3 mm, it was the best cooling efficiency and coefficient of performance."""
Thai to English,ประสิทธิภาพการทำความเย็นสูงสุดที่ 25.2 %,The maximum cooling efficiency was 25.2 % and the maximum coefficient of performance was 0.11.
Thai to English,และมีค่าสมรรถนะการทำความเย็นสูงสุด 0.11 ที่ความดันทางเข้า 2.5 Bar อัตราการไหลอากาศทางเข้า 3.5 m3/h,At the inlet pressure was 2.5 Bar and the flow rate was 3.5 m3/h.
Thai to English,และอุณหภูมิทางออกด้านอุณหภูมิต่ำมีอุณหภูมิของอากาศเย็นต่ำสุดที่ 8.9 °C ลดลงถึง 23.4 °C และด้านทางออกด้านอุณหภูมิสูงมีอุณหภูมิของอากาศร้อนที่ 60.3 °C เพิ่มขึ้นถึง 24.4 °C ที่ความดันทางเข้า 4 Bar อัตราการไหลอากาศทางเข้า 6.5 m3/h,"The air outlet has a minimum cold air temperature of 8.9 °C, a drop of 23.4 °C, and a high temperature of 60.3 °C, an increase of 24.4 °C at an inlet pressure of 4 Bar. Inlet air flow rate 6.5 m3/h"
