prefix,input_text,target_text
Thai to English,"ทดสอบในห้องปฏิบัติการทดสอบ พบว่าความต้านทานแรงอัดที่ผสมเส้นใยกล้วยน้ำว้า0.5 (BF10-05) มีค่ากำลังอัด 30.86 กก./ตร.ซม. สูงกว่าคอนกรีตบล็อกมวลเบาฯที่ผสมเส้นใยสังเคราะห์,  อัตราการดูดซึมน้ำ","In a laboratory for testing, it was discovered that the compressive strength of concrete block combined with banana fibers 0.5 (BF10-05) was 30.86 kg/cm2 higher than that of concrete block mixed with synthetic fibers."
Thai to English,"เมื่อผสมเส้นใยกล้วยน้ำว้า0.5 (BF10-05) มีค่าร้อยละ 4.9 น้อยกว่าผสมเส้นใยสังเคราะห์, ค่าสัมประสิทธิ์การนำความร้อนผสมเส้นใยกล้วยน้ำว้า0.5 (BF10-05) และเส้นใยสังเคราะห์มีค่าใกล้เคียงกัน และการทดสอบการกักเก็บความร้อนด้วยกล่องทดลองพบว่าคอนกรีตบล็อกมวลเบาผสมเส้นใยกล้วยน้ำว้า 0.5 (BF10-05) มีค่าการกักเก็บความร้อนที่ต่ำกว่าผนังคอนกรีตบล็อกและอิฐมอญ 1.86 ถึง 8 องศาเซลเซียส","When mixed with banana fibers 0.5 (BF10-0.5), the water absorption rate was 4.9% lower than mixed with synthetic fibers. Similar result on thermal conductivity coefficients were observed for banana fibers 0.5 (BF10-05) and synthetic fibers. The heat retention test with an experimental box revealed that the lightweight cellular concrete with banana fibers 0.5 (BF10-05) had a lower heat retention value than the concrete block and common brick by 1.86 to 8 degrees Celsius."
Thai to English,เมื่อนำคอนกรีตบล็อกมวลเบาผสมเส้นใยกล้วยน้ำว้า 0.5 (BF10-05) ส่องขยายด้วยกล้องจุลทรรศน์อิเล็กตรอนแบบส่องกราด (SEM) กำลังขยาย 2000-5000 เท่า,The scanning electron microscopy (SEM) at 2000-5000x magnification was used to examined the distribution of banana fibers in lightweight cellular concrete.
Thai to English,สังเกตเห็นการเรียงตัวของเส้นใยกล้วยน้ำว้ากระจายตัว,From the observation of the banana fibers’s scattering and their arrangement.
Thai to English,สามารถแทรกเข้าไปในโครงสร้างคอนกรีตมวลเบาฯโดยไม่ทำลายผนังโพรงอากาศภายในของคอนกรีตบล็อกมวลเบาได้ดีเทียบเท่าเส้นใยสังเคราะห์,It shown that the banana fibers can be mixed well into the lightweight cellular concrete as effective as synthetic fibers without damaging the cavitation walls of the foam bubble structure.
Thai to English,ส่งผลให้คุณสมบัติทางกายภาพของคอนกรีตบล็อกมวลเบาฯผสมกล้วยน้ำว้ามีผลการทดสอบต่างๆที่ดีกว่าเส้นใยสังเคราะห์ และสูงกว่าเกณฑ์มาตรฐานอุตสาหกรรม มอก.2601-2556 ที่กำหนด,"In result, the physical qualities of lightweight cellular concrete mixed with banana fibers perform better in numerous tests than synthetic fibers and also excess of the TIS.2601-2556 industry benchmark."
Thai to English,บทความวิจัยนี้แสดงข้อมูลในการพัฒนากระบวนการวิเคราะห์ค่าปริมาณเชื้อเพลิงสะสมบนผิวดินในป่าเต็งรัง,"This research article aims to the data in the development of the accumulated fuel content in the deciduous dipterocarp forest at Lam Nam Nan National Park, Uttaradit province."
Thai to English,บริเวณอุทยานแห่งชาติลำน้ำน่าน จังหวัดอุตรดิตถ์ มีพื้นที่ป่าเต็งรังประมาณ 100 ไร่,"There is an area of 100 Rai of deciduous dipterocarp forest, with a total of 5 data collection points."
Thai to English,กำหนดจุดเก็บข้อมูลทั้งสิ้น 5 จุดโดยอาศัยเกณฑ์การกำหนดข้อมูลพื้นที่ที่มีความสูง 400 - 600 เมตรจากระดับน้ำทะเล ความลาดชัน 8 -10 องศาทำมุมกับแนวระดับ,"That is based on the criteria for the collection point at an altitude of 400 - 600 meters above sea level, with a slope of 8 - 10 degrees at an angle to the horizontal level."
Thai to English,การเก็บข้อมูลภาพจะทำการถ่ายภาพเรือนยอดต้นไม้และทำการเก็บข้อมูลภาพทุกสัปดาห์เป็นประจำ,The image acquisition takes a picture and collecting time is always taking every week.
Thai to English,ทำการพัฒนาระบบดึงข้อมูลจากแม่ข่ายเพื่อนำข้อมูลภาพเรือนยอดมาใช้วิเคราะห์ และทำปรับโทนสีขาว/ดำแก่รูปภาพ,"Then, researcher will develop a system to retrieve data and use the canopy photo for analysis to adjust the white/black tones."
Thai to English,กรอบข้อมูลภาพที่ใช้จะกำหนดให้มีพฤติกรรมการปกคลุมของเรือนยอดคิดเป็นร้อยละพื้นที่ประมาณ 85 - 95 ของพื้นที่,The image data frame used to define the canopy cover behavior as a percentage area. Approximately 85 - 95 percentages.
Thai to English,ผลการวิเคราะห์พบว่า,"The results of the analysis revealed that the time when the canopy did not defoliate, it was about 85 - 95 percentages."
Thai to English,ในเวลาที่เรือนยอดยังไม่เกิดการผลัดใบอยู่ประมาณร้อยละ 85 - 95 ของพื้นที่ซึ่งเมื่อแปลผลเป็นปริมาณเชื้อเพลิงที่สะสมบนผิวดินด้านล่างเรือนยอดแล้วจะมีค่าประมาณ 0.04 - 0.11 กิโลกรัมต่อตารางเมตร,When converted to the amount of fuel accumulated on the surface below the canopy was approximately 0.04 - 0.11 kilograms per square meter.
Thai to English,เมื่อถึงช่วงกลางเดือนมีนาคมซึ่งนับเป็นช่วงต้นของฤดูการเกิดไฟป่าในประเทศไทย ค่าร้อยละของพื้นที่เม็ดสีดำจะอยู่ในช่วง 20 - 30 ของพื้นที่ทั้งหมดในกรอบข้อมูลภาพ เทียบเท่ากับปริมาณเชื้อเพลิงที่สะสมบนพื้นที่ประมาณ 0.33 - 0.48 กิโลกรัมต่อตารางเมตร,Which is the beginning of the forest fire season in Thailand. The percentage of black pigment grain are is in the range of 20 - 30 percentages. Which is equivalent to the amount of fuel accumulated on the area of approximately 0.33 - 0.48 kilograms per square meter.
Thai to English,ข้อมูลดังกล่าวถูกใช้สร้างแนวโน้มการสะสมเชื้อเพลิงบนผิวดินของป่าเต็งรังเพื่อใช้ขยายผลสู่การคาดการณ์ปริมาณเชื้อเพลิงในป่าเต็งรังจากภาพถ่ายเรือนยอดมีค่าความคลาดเคลื่อน 18% ตามเงื่อนไขตั้งต้นดังกล่าว,The data was used to generate trends in fuel accumulation on the soil surface of the deciduous dipterocarp forest to extend the results to forecast the fuel accumulate in deciduous dipterocarp forests. The amount of fuel accumulated on the surface of the soil can be predicted from the canopy photograph under the aforementioned conditions. There is a tolerance of 18%.
Thai to English,และสามารถใช้เป็นข้อมูลประกอบการตัดสินใจจัดการเชื้อเพลิง,It can also be used for decision support in fuel management.
Thai to English,งานวิจัยเรื่องนี้นำเสนอปัจจัยที่มีอิทธิพลต่อความพึงพอใจของนักท่องเที่ยวเพื่อการบริหารจัดการแหล่งท่องเที่ยวเชิงวัฒนธรรม ซึ่งจะส่งผลต่อด้านจิตวิทยาของประชาชนในพื้นที่,This research presents the factors influencing the satisfaction of the tourists for the management of cultural attractions which will affect the psychology of people in the area.
Thai to English,การเก็บข้อมูลของงานวิจัยนี้อยู่ภายในสถานการณ์การแพร่ระบาดของโรคติดเชื้อไวรัสโคโรนา 2019 (COVID-19),The data collection of this research is within the epidemic situation of coronavirus disease 2019 (COVID-19).
Thai to English,สมมติฐานของการวิจัย คือ วิเคราะห์ข้อมูลที่มีผลต่อจิตวิทยาของประชาชนในพื้นที่ท่องเที่ยวซึ่งคาดว่าปัจจัยที่จะส่งผลด้านจิตวิทยา ได้แก่ 1. ความรู้สึกแออัด 2. สภาพแวดล้อมทางวัฒนธรรมและลักษณะทางภูมิทัศน์ 3. การบริหารจัดการพื้นที่ 4. จำนวนนักท่องเที่ยวที่พบในชุมชน 5. พฤติกรรมของนักท่องเที่ยวคนอื่นๆ,"The hypothesis of the research was to analyze the data affecting the psychology of the people in the tourism area. ""The factors that would affect the psychology were: 1. the feeling of congestion, 2. cultural environment and landscape characteristics, 3. area management, 4. the number of the tourists found in the community, 5. behavior of other tourists."""
Thai to English,และการวิจัยได้มีการศึกษาเปรียบเทียบแหล่งท่องเที่ยวเชิงวัฒนธรรม 3 รูปแบบ คือ กลุ่มที่ 1 การท่องเที่ยววัฒนธรรมชนบท (Rural Cultural Tourism) กลุ่มที่ 2 การท่องเที่ยววัฒนธรรมทันสมัย (Modern Cultural Tourism) และกลุ่มที่ 3 การท่องเที่ยวแหล่งมรดก (Heritage Tourism),"Moreover, in this research, there was a comparative study of 3 types of cultural tourism site: group 1 is the rural cultural tourism (Rural Cultural Tourism), group 2 is the modern cultural tourism (Modern Cultural Tourism), and group 3, heritage tourism (Heritage Tourism)."
Thai to English,"โดยผลการวิจัยพบว่าค่า  มีค่า  จึงสรุปได้ว่าภาพรวมของการบริหารจัดการแหล่งท่องเที่ยวเชิงวัฒนธรรมแต่ละรูปแบบส่งผลต่อความพึงพอใจของนักท่องเที่ยวอย่างมีนัยสำคัญทางสถิติที่ระดับ 0.05 และจากการวิเคราะห์ข้อมูลแต่ละด้านค่า , , ,  และ  มีค่า","The result showed that the value of  resulted in the value of . It could be concluded that each group of cultural tourism management affected tourists’ satisfaction at a statistical significance level of 0.05. ""According to the data analysis in each factor, it was found that the values ​​of , , , , and  resulted in the value of ."""
Thai to English,จึงสรุปได้ว่าการบริหารจัดการของแหล่งท่องเที่ยวเชิงวัฒนธรรมแต่ละรูปแบบส่งผลต่อความรู้สึกพึงพอใจของนักท่องเที่ยวทั้ง 5 ด้านอย่างมีนัยสำคัญทางสถิติที่ระดับ 0.05,It could be concluded that each group of cultural tourism management affected tourists’ satisfaction in all 5 factors at a statistical significance level of 0.05.
Thai to English,และได้มีการเปรียบเทียบการบริหารจัดการแหล่งท่องเที่ยวเชิงวัฒนธรรมในแต่ละรูปแบบของแต่ละด้าน โดยศึกษาความแตกต่างความพึงพอใจของนักท่องเที่ยวในการบริหารจัดการแหล่งท่องเที่ยวเชิงวัฒนธรรมว่ามีความแตกต่างกันมากกว่าหรือน้อยกว่าด้วยการทำการทดสอบภายหลังด้วยสถิติทดสอบ Scheffe,Each group of cultural tourism management was compared to see the difference in tourists’ satisfaction about the cultural tourism management using Scheffe’s statistical test as a post-test.
Thai to English,ซึ่งได้มีการเปรียบเทียบระหว่างกลุ่มที่ 1 กลุ่มที่ 2 และกลุ่มที่ 3 ทั้ง 5 ด้าน พบว่า ค่า มีค่าเป็นลบ และค่า,"According to the comparison between group 1, group 2, and group 3 in all 5 factors, it was found that the value of was negative and , indicating that tourists were satisfied with all 5 factors of cultural tourism management."
Thai to English,ซึ่งแสดงว่านักท่องเที่ยวมีความพึงพอใจในการบริหารจัดการแหล่งท่องเที่ยวทั้ง 5 ด้านของกลุ่มที่ 1 มีความพึงพอใจน้อยกว่ากลุ่มที่ 2 และ 3 อย่างมีนัยสำคัญทางสถิติที่ระดับ 0.05,It could be summarized that group 1 had less satisfaction than group 2 and 3 at a statistical significance level of 0.05.
Thai to English,ดังนั้น การบริหารจัดการแหล่งท่องเที่ยวเชิงวัฒนธรรมในแต่ละรูปแบบจึงต้องมีการวางแผนและการสร้างกลยุทธ์ในการบริหารจัดการแหล่งท่องเที่ยวเชิงวัฒนธรรมที่แตกต่างกันในแต่ละรูปแบบการท่องเที่ยวเพื่อตอบสนองความต้องการของนักท่องเที่ยวได้ตรงตามเป้าหมายของกลุ่มนักท่องเที่ยว,"Hence, the management of cultural attractions in each form requires a planning and the strategies for managing in the different cultural attractions in order to meet the needs of tourists directly to the target group of tourists."
Thai to English,งานวิจัยนี้มีวัตถุประสงค์เพื่อศึกษาความเหมาะสมของการขนส่งสินค้าเกษตรของจังหวัดตากผ่านศูนย์กระจายสินค้าเกษตรโดยใช้ยานพาหนะหลายประเภท,This research aimed to study the suitability of agricultural product transportation in Tak Province by distribution centers (DCs).
Thai to English,การดำเนินการของคณะผู้วิจัยได้ทำการศึกษาข้อมูลสินค้าเกษตรของจังหวัดตาก,"For the research implementation, the researchers studied the data of agricultural products in Tak Province."
Thai to English,จากนั้นได้พัฒนารูปแบบทางคณิตศาสตร์เพื่อใช้สำหรับแก้ปัญหาการขนส่งสินค้าเกษตรโดยมีเป้าหมายคือค่าใช้จ่ายในการขนส่งต่ำที่สุด,"Then, we developed a mathematical model to solve the agricultural product transportation problem for the minimum transportation expenses."
Thai to English,โดยใช้รูปแบบการขนส่ง 3 รูปแบบ ได้แก่ รูปแบบที่ 1 คือรูปแบบเดิม การขนส่งจากแหล่งปลูกไปยังแหล่งปลายทางโดยตรง รูปแบบที่ 2 คือการขนส่งผ่านศูนย์กระจายสินค้า (Distribution center) เท่านั้น และรูปแบบที่ 3 คือการขนส่งที่ผสมผสานระหว่างการขนส่งผ่านศูนย์กระจายสินค้าและขนส่งโดยตรงไปยังลูกค้า,"This was considered together with truck sizes by using 3 transportation models, i.e, Model 1: The regular direct transportation from origins to destinations, Model 2: Transportation by DCs, and Model 3: Transportation by DCs and direct transportation."
Thai to English,ทั้งนี้ผู้วิจัยได้รวบรวมข้อมูลสินค้าเกษตรจากสำนักงานเกษตรตาก ปีพ.ศ. 2560 ถึง ปีพ.ศ.2563 รวมระยะเวลา 4 ปี และได้ทำการออกแบบชุดข้อมูลตัวอย่างจำนวน 2 ชุดข้อมูล เพื่อทดสอบผลของคำตอบที่เปลี่ยนแปลงไปเมื่อปริมาณสินค้าและความต้องการเกิดการเปลี่ยนแปลง,"The researcher collected the data of agricultural products from Tak Provincial Agricultural extension Office for 4 years between 2017 – 2020, and designed the samples of 2 datasets for testing the results of changeable answers when product volumes and consumer demands changed."
Thai to English,จากนั้นทำการแก้ไขรูปแบบทางคณิตศาสตร์ร่วมกับข้อมูลจากชุดตัวอย่างต่างๆ โดยโปรแกรมสำเร็จรูป AMPL,"Next, the mathematical models were revised together with the data of the datasets by AMPL."
Thai to English,เครื่องมือการแก้ปัญหาคือ GUROBI ซึ่งเป็นวิธีการแก้ปัญหาแบบเที่ยงตรง,GUROBI was used as a problem-solving tool and a valid method.
Thai to English,จากนั้นนำผลที่ได้มาวิเคราะห์ค่าใช้จ่ายที่เกิดขึ้น,"After that, the results were brought for expense analysis."
Thai to English,พบว่า รูปแบบที่ 3 ให้ต้นทุนในการขนส่งต่ำที่สุด,It was found that Model 3: Transportation by DCs and direct transportation generated minimum transportation cost.
Thai to English,บทความนี้ได้นำเสนอแบบจำลองของมอเตอร์ไฟฟ้ากระแสตรงแบบไร้แปรงถ่านที่มีชุดบอร์ดขับเคลื่อน,This paper presents the model of brushless direct current motor including the commercial driver board.
Thai to English,โดยทั่วไปมอเตอร์ดังกล่าวจะถูกควบคุมการทำงานเพื่อให้สามารถใช้งานในระดับความเร็วรอบที่ต้องการได้,"Generally, the motor speed is controlled by setting the desired conditions."
Thai to English,แบบจำลองที่มีความถูกต้องเพื่อใช้สำหรับออกแบบตัวควบคุมจึงมีความสำคัญ,The accurate model for the controller design is very important.
Thai to English,แต่อย่างไรก็ตามแบบจำลองทางคณิตศาสตร์แบบแม่นตรงของระบบดังกล่าวมีความซับซ้อนเป็นอย่างมาก,"However, the exact mathematical model is very complicated."
Thai to English,บทความนี้จึงได้นำเสนอแบบจำลองกล่องดำเพื่ออธิบายผลการตอบสนองของมอเตอร์ไฟฟ้ากระแสตรงแบบไร้แปรงถ่านที่มีชุดขับเคลื่อน,"As a result, this paper presents the black-box model to explain the response of the brushless direct current motor driven by the commercial driver board."
Thai to English,แบบจำลองดังกล่าวจำเป็นต้องระบุค่าสัมประสิทธิ์ของฟังก์ชันถ่ายโอน,The identification of the proposed model is necessary to search the transfer function coefficients.
Thai to English,ดังนั้นบทความนี้จึงได้ประยุกต์ใช้วิธีการทางปัญญาประดิษฐ์สำหรับการระบุเอกลักษณ์แบบจำลองกล่องดำที่อยู่ในรูปของฟังก์ชันถ่ายโอน,"Therefore, this paper presents the artificial intelligence techniques to identify the black-box model represented by the transfer function."
Thai to English,วิธีการที่นำเสนอในบทความนี้ได้แก่ การค้นหาแบบจีนเนติกอัลกอริทึม (GA) การค้นหาแบบการเคลื่อนที่ของกลุ่มอนุภาค (PSO) และการค้นหาแบบตาบูเชิงปรับตัว (ATS) ซึ่งจะทำการค้นหาจนกว่าค่าความคาดเคลื่อนจะมีค่าน้อยที่สุด,"The proposed genetic algorithm (GA), particle swarm optimization (PSO) and adaptive tabu search (ATS) will tune the unknown parameters until the minimum fitness value is obtained."
