prefix,input_text,target_text
English to Thai,This resulted in variability in the DLT testing.,ซึ่งทำให้ผลทดสอบเสาเข็มแบบพลศาสตร์มีความแปรปรวน
English to Thai,The analysis also found that the loading capacity of the piles obtained from the DLT testing was not directly proportional to the reduction of settlement and the safety ratio was up to 3.0-3.7 times.,ผลการวิเคราะห์ยังพบอีกว่าน้ำหนักบรรทุกของเสาเข็มที่ได้จากการทดสอบแบบพลศาสตร์ไม่ได้แปรผันตรงกับค่าการทรุดตัวที่ลดลงและค่าอัตราส่วนความปลอดภัยมีค่าสูงระหว่าง 3.0 ถึง 3.7 เท่า และการทดสอบ DLT
English to Thai,And DLT testing should be more than 3 piles for averaged and analyzed in conjunction with PLAXIS 2D for a more reliable load capacity.,ควรทดสอบอย่างน้อย 3 ต้น เพื่อหาค่าเฉลี่ยแล้วนำไปวิเคราะห์ร่วมกับโปรแกรม PLAXIS 2D เพื่อให้การประเมินน้ำหนักบรรทุกมีความน่าเชื่อถือเพิ่มขึ้น
English to Thai,"The research paper presents a suitability of local islanding detection methods for grid-connected inverter in multi-distributed generation, and possible usage of local techniques for an anti-islanding condition, which is caused by the ever-increasing installation of distributed generation.",บทความวิจัยนี้นำเสนอความเหมาะสมของเทคนิคการตรวจจับการเกิดการจ่ายไฟแบบแยกตัวอิสระแบบโลคอลสำหรับอินเวอร์เตอร์เชื่อมต่อในหลายหน่วยผลิตไฟฟ้าแบบกระจายตัว เพื่อเป็นแนวทางในการใช้ประโยชน์เทคนิคแบบโลคอลสำหรับต่อต้านสภาวะการแยกตัวอิสระซึ่งเกิดจากการติดตั้งหน่วยผลิตไฟฟ้าแบบกระจายตัวเพิ่มมากขึ้นเรื่อย ๆ
English to Thai,"The paper uses 5 distributed generations, resulting in 15 forms.",ในบทความนี้ใช้หน่วยผลิตไฟฟ้าแบบกระจายตัวจำนวน 5 ตัว ทำให้ได้ 15 รูปแบบ
English to Thai,"According to the simulation results, it was found that if the distributed generation is increasing until the power of the distributed generation equal or close to the power of the whole load, and if the inverter of all 5 distributed generations used a passive technique, they cannot be detected.",จากผลการจำลองการทำงานพบว่าหากหน่วยผลิตไฟฟ้าแบบกระจายตัวมีจำนวนเพิ่มขึ้นจนกระทั่งปริมาณกำลังไฟฟ้าของหน่วยผลิตไฟฟ้าแบบกระจายตัวเท่ากันหรือใกล้เคียงกับกำลังไฟฟ้าของโหลดทั้งระบบ ถ้าอินเวอร์เตอร์ของหน่วยผลิตไฟฟ้าแบบกระจายตัวทั้ง 5 ตัวใช้เทคนิคแบบพาสซีฟจะไม่สามารถตรวจจับได้
English to Thai,"If they used an active technique, they can be detected in 0.24 seconds.",ถ้าใช้เทคนิคแบบแอคทีฟทั้งหมดจะสามารถตรวจจับได้ภายในเวลา 0.24 วินาที
English to Thai,"If they used a hybrid technique, they can be detected in 0.282 seconds.",ถ้าใช้เทคนิคแบบไฮบริดทั้งหมดจะสามารถตรวจจับได้ภายในเวลา 0.282 วินาที
English to Thai,"If they mixed passive, active and hybrid techniques, they can be detected in 0.315 seconds.",และถ้าผสมเทคนิคแบบพาสซีฟ แบบแอคทีฟ และแบบไฮบริดจะสามารถตรวจจับได้ภายในเวลา 0.315 วินาที
English to Thai,This paper presents an application of remote sensing data using LANDSAT-8 satellite images for land use identification to estimate Manning's roughness coefficient.,บทความนี้นำเสนอการประยุกต์ใช้ข้อมูลจากการสำรวจระยะไกลโดยการนำภาพถ่ายดาวเทียม LANDSAT-8 ในการจำแนกการใช้ที่ดินเพื่อกำหนดค่าสัมประสิทธิ์ความขรุขระของแมนนิ่งในการประยุกต์ใช้ร่วมกับแบบจำลอง HEC-RAS สองมิติ โดยมีการจำแนกการใช้ที่ดินเป็น 4 ประเภท
English to Thai,"Then, the land use from satellite images with a two-dimensional HEC-RAS mathematical model is presented.",และใช้การจำแนกแบบกำกับดูแลด้วยวิธี Minimum Distance
English to Thai,"The accuracy of the land use classification was tested, and four categories of land use were categorized using the minimum distance which is a supervised classification technique.",และทำการตรวจสอบความถูกต้องของการจำแนกการใช้ที่ดิน
English to Thai,"Then, the Manning’s roughness coefficient determined from the land-use data was used for two-dimensional simulation.",จากนั้นนำข้อมูลการใช้ที่ดินนี้มากำหนดสัมประสิทธิ์ความขรุขระของแมนนิ่งเชิงพื้นที่และข้อมูลน้ำท่ามาจำลองด้วยแบบจำลองการไหลสองมิติ
English to Thai,"To calibrate and validate this study, data from 2011 and 2014 were used.",ข้อมูลการศึกษานี้ได้สอบเทียบแบบจำลองในปี พ.ศ. 2554 และตรวจพิสูจน์ในปี พ.ศ.2557
English to Thai,"The best result has an NSE of 0.95-0.97 and an R2 of 0.96-0.99, indicating that it is highly accurate.",ได้ผลที่ดีที่สุดคือมีค่า NSE อยู่ในช่วง 0.95-0.97 และมี R2 อยู่ในช่วง 0.96-0.99 ซึ่งหมายถึงแบบจำลองมีความแม่นยำสูง
English to Thai,This two-dimensional HEC-RAS model has the benefit of being able to simulate flooded regions in varied land use characteristics while using remote sensing data from LANDSAT-8 satellite images.,โดยการประยุกต์ใช้ข้อมูลการสำรวจระยะไกลจากภาพถ่ายดาวเทียม LANDSAT-8 ในแบบจำลอง HEC-RAS สองมิตินี้มีข้อดีคือสามารถจำลองพื้นที่น้ำท่วมในลักษณะการใช้ที่ดินต่างๆ ได้
English to Thai,Coral reefs are an important coastal ecosystem in terms of biological and economic points of view.,ปะการังเป็นหนึ่งในระบบนิเวศชายฝั่งที่มีความสำคัญทั้งในเชิงชีววิทยา และมูลค่าทางเศษฐกิจ
English to Thai,They are vulnerable to both environment change and resource utilization.,แนวปะการังมีความเปราะบางต่อการเปลี่ยนแปลงของสภาพแวดล้อม และกิจกรรมการใช้ประโยชน์
English to Thai,"Therefore, continuous monitoring is necessary for applying the appropriate management.",ดังนั้นการบริหารจัดการ การใช้ประโยชน์ที่เหมาะสม จึงจำเป็นที่จะต้องติดตามสภาวะของปะการังอย่างต่อเนื่อง
English to Thai,"However, the in-situ coral reefs standard method survey is expensive and time-consuming.",แต่การสำรวจปะการังด้วยการดำน้ำตามวิธีมาตรฐานมีค่าใช้จ่ายสูง และใช้เวลามาก
English to Thai,This study presents the use of Google Earth Engine (GEE) using Sentinel-2 satellite data with a minimum distance classification technique to map coral reefs.,การศึกษานี้เสนอการใช้กูเกิ้ลเอิร์ธเอนจิ้น (GEE) ในการสร้างแผนที่แนวปะการัง จากข้อมูลของดาวเทียม Sentinel-2 ด้วยเทคนิคการจำแนกแบบระยะห่างน้อยที่สุด
English to Thai,Ground truth data for satellite data training and validating was collected using drones.,และใช้โดรนเก็บข้อมูลภาคสนามมากำกับการจำแนก
English to Thai,Coral reefs at Rawai beach are classified using this method as 348 rai.,และตรวจสอบความถูกต้อง ผลการทดสอบการจำแนกแนวปะการังบริเวณชายฝั่งหาดราไวย์ จังหวัดภูเก็ต พบว่าบริเวณนี้มีพื้นที่ปะการังประมาณ 348 ไร่
English to Thai,"The total accuracy of classification is 71% and the kappa coefficient is 0.57. ""The accuracy of individual classification of sand, coral, and sandy coral is 86.2%, 68.8%, and 58.6%, respectively.""","แผนที่แนวปะการังมีความถูกต้องรวมร้อยละ 71, มีค่าสัมประสิทธิ์แคปปา 0.57, มีค่าความถูกต้องในการจำแนกรายชนิด เป็นทราย, ปะการัง และปะการังปนทราย เท่ากับร้อยละ 58.6, 86.2 และ 68.8 ตามลำดับ"
English to Thai,"The objectives of this research were to study the temperature distribution simulation in insulated Anila-type biochar kiln with size of 50, 100 and 200 liters and to study the effects of biomass material types, kiln size, and pyrolysis time on temperature distribution in the insulated biochar kiln, biochar yield, and biochar property.",วัตถุประสงค์ของงานวิจัยคือเพื่อศึกษาการจำลองสภาพการกระจายอุณหภูมิในเตาเผาถ่านชีวภาพแบบหุ้มฉนวนขนาด 50 100 และ 200 ลิตร โดยใช้เตาเผาแบบแอนิลา ศึกษาผลของชนิดวัสดุชีวมวล ขนาดเตา และเวลาที่ใช้ในการแยกสลายด้วยความร้อนที่มีต่อการกระจายอุณหภูมิในเตาเผาถ่านชีวภาพแบบหุ้มฉนวน ปริมาณถ่านชีวภาพ และสมบัติของถ่านชีวภาพ
English to Thai,The correlations between the variables related to the biochar production were furthermore investigated.,และหาสหสัมพันธ์ของตัวแปรในการผลิตถ่านชีวภาพ
English to Thai,"The core of the kiln had a puncture diameter of 3.17 mm, number of the puncture of 15, 24 and 44, respectively.",ซึ่งการออกแบบเตาเผาถ่านชีวภาพจะมีขนาดรูเจาะแกนกลาง 3.17 มิลลิเมตร จำนวน 15 24 และ 44 รูเจาะตามลำดับ
English to Thai,The results showed that a 200-liter biochar kiln with biomass as the husk rice had the highest biochar yield of 51.1%.,ผลการศึกษาพบว่าเตาเผาถ่านชีวภาพขนาด 200 ลิตร ที่ใช้ชีวมวลเป็นแกลบให้ปริมาณถ่านชีวภาพสูงที่สุดเท่ากับ 51.1 เปอร์เซ็นต์
English to Thai,"Based on the simulation results, the average temperature distribution at pyrolysis time of 1, 2 and 3 hours was 459.4±184.9 °C, 468.7±100.3 °C and 353.1±97.8 °C, respectively, when compared with the experiment results the error was 6.5±6.2, 3.9±4.1 and 0.9±0.9%, respectively.",โดยจากการจำลองสภาพกระจายอุณหภูมิพบว่าอุณหภูมิเฉลี่ยที่เวลา 1 2 และ 3 ชั่วโมง คือ 459.4±184.9 468.7±100.3 และ 353.1±97.8 องศาเซลเซียส ตามลำดับ เมื่อเปรียบเทียบกับการทดสอบให้ความคลาดเคลื่อนเท่ากับ 6.5±6.2 3.9±4.1 และ 0.9±0.9 เปอร์เซ็นต์ ตามลำดับ
English to Thai,"From the correlation equation, it was found that average temperature inside the kiln had no significant effect on the biochar yield and acidity-alkalinity.",และจากสมการสหสัมพันธ์พบว่าอุณหภูมิเฉลี่ยในเตาเผาไม่ได้มีผลต่อปริมาณของถ่านชีวภาพและค่าความเป็นกรด-ด่างของถ่านชีวภาพอย่างมีนัยสำคัญ
English to Thai,"On the other hand, the kiln dimensional parameters, i.e. ""A/Ap, L/D, pyrolysis time and biomass material type had an effect on the biochar yield.""",แต่กลับเป็นตัวแปรมิติของเตา ได้แก่ A/Ap และ L/D เวลาที่ใช้ในการแยกสลายด้วยความร้อน และชนิดของชีวมวล ที่ส่งผลต่อปริมาณของถ่านชีวภาพ
English to Thai,"Furthermore, the A/Ap, L/D and pyrolysis time had an effect on the acidity-alkalinity of biochar as well.",นอกจากนี้ยังพบว่า A/Ap L/D และเวลาที่ใช้ในการแยกสลายด้วยความร้อน เป็นปัจจัยที่ส่งผลต่อค่าความเป็นกรด-ด่างของถ่านชีวภาพด้วย
English to Thai,"From the results of this research, the temperature distribution characteristics of different kiln sizes and conditions affecting the biochar yield and acidity-alkalinity obtained from the biochar production were revealed.",จากผลการวิเคราะห์นี้ทำให้ทราบถึงลักษณะการกระจายอุณหภูมิของเตาเผาที่มีขนาดแตกต่างกันและปัจจัยต่าง ๆ ที่ส่งผลต่อปริมาณถ่านชีวภาพและค่าความเป็นกรด-ด่างของถ่านชีวภาพที่ได้จากกระบวนการผลิต
English to Thai,This study aims to explore soil moisture data sources and review various techniques for obtaining soil moisture data from remote sensing technology.,การศึกษาครั้งนี้มีวัตถุประสงค์หลัก คือ การค้นคว้าเพื่อหาแหล่งข้อมูลความชื้นของดินที่มีการสำรวจตรวจวัดจากเทคโนโลยีการรับรู้จากระยะไกลและการพัฒนาตัวอย่างการประยุกต์ใช้งานข้อมูลเพื่อเป็นพื้นฐานให้แก่นักวิจัยและผู้ที่ศึกษาด้านทรัพยากรธรรมชาติและสิ่งแวดล้อมสำหรับการต่อยอดองค์ความรู้และการประยุกต์ใช้งานในด้านที่เกี่ยวข้อง
English to Thai,"Results reveal available data sources that allow users to access, download and manipulate the soil moisture data via the internet.",บทความนี้ได้กล่าวถึงองค์ความรู้พื้นฐานของการรับรู้จากระยะไกล กระบวนการที่เกี่ยวข้องกับการสำรวจและการตรวจวัดความชื้นของดิน
English to Thai,Remote sensing techniques and their related methods for extracting the soil moisture data are also mentioned.,การตรวจวัดความชื้นของดินด้วยเทคโนโลยีการรับรู้จากระยะไกล
English to Thai,"According to the demonstrated result, the use of soil moisture data can be applied to the engineering and environmental application, burning area, and air pollution (PM10 and PM2.5) management and disaster monitoring efficiently.",รวมถึงการแสดงรายละเอียดโดยสรุปของแหล่งข้อมูลความชื้นของดินที่มีให้บริการผ่านเครือข่ายอินเน็ตพร้อมตัวอย่างการประยุกต์ใช้งาน การศึกษาครั้งนี้สามารถประยุกต์ใช้งานข้อมูลความชื้นของดินในการประยุกต์ใช้งานทางวิศวกรรมและด้านทรัพยากรธรรมชาติและสิ่งแวดล้อม การบริหารจัดการพื้นที่เผาไหม้ ปัญหาหมอกควัน (PM10 และ PM2.5) และการเฝ้าระวังด้านภัยพิบัติได้อย่างมีประสิทธิภาพ
English to Thai,Water loss (WL) in water distribution systems (WDS) is a main problem of waterworks in Thailand.,น้ำสูญเสียในระบบสูบจ่ายน้ำเป็นปัญหาสำคัญของหน่วยงานประปาของประเทศไทย
English to Thai,A WDS can be divided into a trunk main network (TMN) and a water distribution network. Metropolitan Waterworks Authority (MWA) estimates WL in its TMN about 60-120 million m3/year.,โดยระบบสูบจ่ายน้ำสามารถแบ่งเป็นโครงข่ายท่อประธานและโครงข่ายท่อจ่ายน้ำ การประปานครหลวง (กปน.) คาดว่าโครงข่ายท่อประธานมีน้ำสูญเสีย 60-120 ล้าน ลูกบาศก์เมตรต่อปี
English to Thai,"Thus, this research presents a monitoring system using the water balance method for 4 routes of the MWA Prachachuen Branch TMN with fairly complete permanent measured flow data from the Remote Monitoring System.",ดังนั้นงานวิจัยนี้จึงนำเสนอระบบเฝ้าระวังน้ำสูญเสียท่อประธานด้วยวิธีสมดุลน้ำสำหรับ 4 เส้นทางของสาขาประชาชื่นของ กปน. ที่มีข้อมูลมาตรวัดค่อนข้างน่าเชื่อถือ
English to Thai,"Water balance consists of 2 cases: 1) long-term water balance for continuous WL calculation by the data of permanent meters in SCADA systems, and 2) short-term water balance for the case that some flow meters malfunction.",การทำสมดุลน้ำที่ใช้มี 2 วิธี คือ 1) สมดุลน้ำระยะยาว โดยคำนวณน้ำสูญเสียต่อเนื่องจากข้อมูลมาตรถาวรในระบบตรวจวัดระยะไกล SCADA และ 2) สมดุลน้ำระยะสั้น
English to Thai,"By closing water flowing through those meters temporarily at night, WL can be computed for a short period of 2-3 hours.",ในกรณีมาตรถาวรบางตัวมีปัญหาจะปิดมาตรเพื่อไม่ให้น้ำไหลผ่านจุดนั้นในช่วงกลางคืนทำให้สามารถคำนวณน้ำรั่วได้ชั่วคราวประมาณ 2-3 ชั่วโมง
English to Thai,The results show that 1st method can calculate WL if all flow meters work properly.,ผลการทำสมดุลน้ำวิธีที่ 1 พบว่า สามารถคำนวณน้ำสูญเสียบนเส้นทางได้ดีหากมาตรทุกตัวทำงานปกติ
English to Thai,2nd method can temporarily estimate WL.,และวิธีที่ 2 สามารถคำนวณน้ำสูญเสียชั่วคราวได้ดี
English to Thai,And both methods estimate WL with a flow discrepancy of tens digit m3/hr.,โดยทั้งสองวิธีมีความคลาดเคลื่อนในหลักสิบ ลูกบาศก์เมตรต่อชั่วโมง
English to Thai,"Thus, the system is effective in monitoring leakage on TMN.",แสดงว่าระบบเฝ้าระวังนี้มีประสิทธิภาพในการติดตามน้ำรั่วบนท่อประธานได้
English to Thai,The model for water distribution networks (WDNs) is an important tool to support network operations.,แบบจำลองโครงข่ายท่อน้ำประปาเป็นตัวช่วยในการตัดสินใจสำหรับการบริหารจัดการ
English to Thai,The model requires an accurate calibration to represent an actual network.,ซึ่งการใช้แบบจำลองที่เป็นตัวแทนของโครงข่ายท่อน้ำประปาจริงได้ต้องทำการสอบเทียบ
English to Thai,The calibration process is to minimize the sum square error (SSE) between the simulated values and the measurements on both flow and pressure.,งานวิจัยฉบับนี้ได้นำเสนอกระบวนการสอบเทียบแบบจำลองชลศาสตร์โดยลดค่าผลรวมผลต่างกำลังสองของอัตราการไหลจากแบบจำลองกับค่าตรวจวัด และ แรงดันจากแบบจำลองกับค่าตรวจวัด
English to Thai,This research proposes a calibration method using the Brent's optimization.,โดยอาศัยวิธีการหาค่าเหมาะสมที่สุดตามวิธีการ Brent’s Method ซึ่งมีกระบวนการดังนี้
