"The objective of this academic article is to present the idea of incorporating gamefication in teaching methods, based on the experience of the author."
It is a way to study the format and concept of creating games that make learning science-related topics more interesting.
"By using games can be applied to learning activities, making it possible for students to learn while having fun."
The results of this approach not only bring enjoyment but also contribute to learning effectiveness and lead to changes in some of the learners.
"By incorporating the elements of fun, students become more engaged, enthusiastic, and motivated in learning activities."
"The article aims to demonstrate how the concept of gamefication can be used beyond gaming, and encourages readers to explore a broader perspective using science techniques to achieve the ultimate objective."
